title,link,description,bloggername,bloggerlink,postdate
<b>아이폰12</b> PRO 가격 할인받아 개통,https://blog.naver.com/rewq2505?Redirect=Log&logNo=222349637013,애플의 첫 5G폰 iPhone 12 시리즈 중에서 <b>아이폰12</b> PRO는 초반 출시 당시에는 재고를 구하기가 어려웠을... 두서 없게 썼는데 제 글이 도움이 많이 되었으면 좋겠네요!ㅎㅎ &gt;&gt;&gt; 아이폰 특가전 보러가기,보리언니의 소소한 일상,https://blog.naver.com/rewq2505,20210513
[iPhone] <b>아이폰 12</b> 퍼플 (가로수길 애플 스토어 픽업),https://blog.naver.com/hjha0109?Redirect=Log&logNo=222352921850,"iPhone 12 퍼플 리뷰 부제 : 내가 보려고 기록해 놓는 ••• 갑작스럽게 폰을 바꾸게 됐다. 2017년도... 출처 : Youtube 잇섭 (위) <b>아이폰12</b> 프로 퍼시픽블루 (아래,왼쪽에서부터) 아이폰11퍼플, <b>아이폰12</b>퍼플... ",•보통의 보통날•,https://blog.naver.com/hjha0109,20210516
<b>아이폰12</b> 퍼플 사전예약 20만원대로 하는법,https://blog.naver.com/hochil?Redirect=Log&logNo=222320714507,"애플은 매년 9월 아이폰 신제품을 공개합니다. 작년의 경우 코로나 19로 인해 9월이 아닌 10월에... 그 중 하나가 바로 <b>아이폰12</b> 퍼플입니다. 기존에 나왔던 iPhone 12 미니와 iPhone 12에는 블루, 그린, 블랙... ",길따라 바람따라,https://blog.naver.com/hochil,20210424
<b>아이폰</b> 11 Pro Max <b>12</b> 가격 스펙 비교 지금 써도 괜찮을까?,https://blog.naver.com/bubble_cook?Redirect=Log&logNo=222349446989,"이런 관점에서 아이폰 11 Pro Max와 12Pro Max 두 모델의 스펙을 비교해봤습니다. 위의 표를 보면 한 눈에... 물론 세부적인 사항을 살펴보면 아무래도 <b>아이폰 12</b> Pro Max의 손을 들어줄 수 밖에 없지만, 브이로그... ",모태솔로몬,https://blog.naver.com/bubble_cook,20210513
<b>아이폰12</b> 비교해보고 구매했어요!,https://blog.naver.com/bythistime?Redirect=Log&logNo=222345099694,얼른 시간이 가길 바라는 마음으로 <b>아이폰12</b>를 구매하고자 하는 분들이 늘어나고 있는 추세입니다.... 저 역시 최근에 <b>아이폰12</b>를 사면서 이런 곳이 있다는 것에 다시 한번 놀랄 수밖에 없었는데요. 경험한... ,쏘쏘한 일상♬,https://blog.naver.com/bythistime,20210510
<b>아이폰12</b> mini 미니 단풍 손에 들어오다,https://blog.naver.com/khy812?Redirect=Log&logNo=222336580026,누나가 <b>아이폰12</b>미니 쓰고 내가 누나꺼 쓸께 YES~ 기회다 싶어 동생이랑 폰 바꿨어요 ㅋㅋㅋ 원래 동생도 아이폰13 나오면 바꾸려다 제가 12프로맥스 야무지게 넘겨 받았어요 물론 사용감도 없이 한번도 안... ,형이의 소소한 일상♡,https://blog.naver.com/khy812,20210504
맥세이프 <b>아이폰12</b>충전기 매력있어요!,https://blog.naver.com/bbiyou?Redirect=Log&logNo=222352424436,CHOETECH 저도 몇 개월 전 애플워치와 아이폰 + 에어팟 동시 충전되는 제품을 써보고 좋아서 친구에게... ( 정품 아니지만 자력 괜찮은 편 ) 저는 <b>아이폰 12</b> 프로 유저인데 두꺼운 그립 톡이 붙은 스마트폰... ,잘나가는 빠워블로거❤ 봉여사,https://blog.naver.com/bbiyou,20210516
<b>아이폰12</b> PRO 가격 저렴하게 구입,https://blog.naver.com/greenmeant29?Redirect=Log&logNo=222349722131,5배 광학 줌인과 5배 광학 줌 업위에 최대 12배 디지털 줌을 지원하거든요. 크기와 무게까지 감안하면 PRO 모델이 더 좋다고 생각하지만 이는 사람마다 다르겠죠? 지금 <b>아이폰12</b> PRO 가격은 공시지원금이... ,자연스럽게,https://blog.naver.com/greenmeant29,20210513
<b>아이폰12</b> 퍼플 핫한 이유 가격 정보,https://blog.naver.com/bomhui32?Redirect=Log&logNo=222345262732,"전작 iPhone 11시리즈는 일반, 프로, 프로맥스 3가지로 나왔던 반면 이번에는 그보다 아이폰11, 아이폰11... 크기 자체는 12 PRO와 같습니다. 그리고 프로세서 역시 <b>아이폰12</b>시리즈에 적용되었던 A14바이오닉 칩을... ",the present,https://blog.naver.com/bomhui32,20210510
<b>아이폰 12</b>프로 듀얼유심개조記,https://blog.naver.com/cafeapple888?Redirect=Log&logNo=222342516479,"이어져, 아이폰 11은 듀얼유심 개조가 용이했던데 반해, 11 Pro와 11 Pro Max는 메인보드 일체형으로 나와서, 그다지 효용성이 높지 않았습니다. 그러던 것이, <b>아이폰12</b> 시리즈에 와서는 <b>아이폰 12</b> 미니를 제외한 12... ",시간을 달리다...Timeless Stories,https://blog.naver.com/cafeapple888,20210508
"<b>아이폰12</b> 미니, 요즘 가격! 퍼플 색상은 언제?",https://blog.naver.com/clubkang?Redirect=Log&logNo=222324588977,최근 발표회를 통해 퍼플 색상이 깜짝 공개되며 다시금 주목을 받고 있는 <b>아이폰12</b> 미니입니다. 일반형... 이번 iPhone12 mini는 5.4인치 소형 디스플레이를 탑재하고 있는 작은 모델이지만 스펙이 떨어지는... ,워터포르의 디지털 시간여행&와포TV,https://blog.naver.com/clubkang,20210427
<b>아이폰12</b> 퍼플 고민? 자급제로 구매하면 좋은 점!,https://blog.naver.com/jswon34?Redirect=Log&logNo=222348797276,"그리고 월 12G정도의 데이터가 제공되며, 문자와 음성통화는 무제한으로 이용하실 수 있습니다. <b>아이폰12</b> 퍼플을 통신사에서 구매했을 때(자급제 이용하지 않았을 때)는 2년간 약 204만원정도 나온다고... ",Leibliz’s Blog Story,https://blog.naver.com/jswon34,20210513
<b>아이폰12</b> 퍼플 사전예약 가격 쿠팡 정보,https://blog.naver.com/berebere78?Redirect=Log&logNo=222320631401,"▶<b>아이폰12</b> 퍼플 사전예약 바로가기[클릭] 12 시리즈는 작년 하반기에 나온 모델이며 일반,미니,프로,프로맥스 4가지 라인업으로 구성 된 스마트폰입니다. 색상은 라인업이 올라갈수록 그래파이트,골드 등 추가... ",배레배레의 블로그,https://blog.naver.com/berebere78,20210423
<b>아이폰12</b>미니 신비로운 퍼플 색상 10만원 가격대로~,https://blog.naver.com/unyi1028?Redirect=Log&logNo=222345278389,이번에 애플에서 <b>아이폰12</b>미니의 새로운 색상이 나왔어요. 기존에 있던 색상도 예뻤는데 이번에 새로... 우선 저렴하다고 하더라도 제일 중요한 건 <b>아이폰12</b>미니 후기와 스펙을 살펴보는 거예요. 아무리 싸도... ,하루곰네 이야기,https://blog.naver.com/unyi1028,20210510
<b>아이폰12</b> 퍼플 드디어 겟!!,https://blog.naver.com/sohwa91?Redirect=Log&logNo=222353540416,오늘은 제가 얼마전에 겟한 #<b>아이폰12</b>퍼플 소개를 해볼까해요!!!!ㅎㅎㅎ 사실 저는 원래 갤럭시를... 제 친구는 아이폰13이랑 12퍼플 고민하던데 저는 그냥 12퍼플로도 충분히 만족해여 ㅠㅠㅠㅠ 앞으로... ,˚✧₊❁⁎솨의봄날⁎⁺˳❁✧༚,https://blog.naver.com/sohwa91,20210516
<b>아이폰12</b> 미니 퍼플 가격 10만원대 구매후기,https://blog.naver.com/hochil?Redirect=Log&logNo=222352131089,스마트폰의 전체적인 크기는 당연히 iPhone12 MINI가 훨씬 아담하고요. 또 <b>아이폰12</b> 미니 퍼플 색상이 조금 더 진하고 선명한 느낌이 있어요. 채도가 조금 더 높다고 해야 할까요. 근데 또 촌스러운 퍼플이... ,길따라 바람따라,https://blog.naver.com/hochil,20210517
<b>아이폰12</b> 미니 가격 떨어지다 컬러까지 확인해보니,https://blog.naver.com/neces2?Redirect=Log&logNo=222350583481,"오늘은 <b>아이폰12</b> 미니 가격 소식과 함께 새로운 컬러 퍼플이 후기를 전해드리려고 합니다. 이미... 맥세이프를 사용하면 최대 12W 충전이 가능합니다. 스토리지의 경우 64GB부터 시작을 합니다. 64GB, 128GB, 256GB... ",네세스의 IT STORY,https://blog.naver.com/neces2,20210514
<b>아이폰12</b>프로 최대 80만원 저렴하게 구입하는 방법,https://blog.naver.com/bubble_cook?Redirect=Log&logNo=222299356151,특히 아이폰의 경우 하나의 명품 처럼 인식되기도 하는데요. 작년 <b>아이폰12</b>는 원래 출시 패턴과는 달리 조금 늦게 공개가 되었습니다. 가장 대표적인 변화라고하면 5G를 적용한 최초의 애플 제품이 되었는데요.... ,모태솔로몬,https://blog.naver.com/bubble_cook,20210405
"애플 <b>아이폰 12</b> 구매 후기, 프로와 맥스를 제치고 미니를 지른 썰",https://blog.naver.com/supapa13?Redirect=Log&logNo=222347273018,"아이폰 8에 A13 칩셋만 심어둔 모델이기 때문인데, 덩달아 배터리 광탈도 심했었습니다. 그에 반해 <b>아이폰 12</b> 중에서도 미니는 프로와 맥스 등의 플래그십 라인업과 당당히 함께 출시된 제품이었기에 A14... ","세수하면이병헌 IT, 육아",https://blog.naver.com/supapa13,20210512
아이폰11 롱텀후기 <b>아이폰12</b> 비교해보니 더낫네?,https://blog.naver.com/dicagallery?Redirect=Log&logNo=222307384694,"그러나 실제 사용해본 결과 11과 12의 차이는 그리 크지 않았다. 아이폰 11이 더 사실적으로 촬영해준 반면, <b>아이폰 12</b>는 조금 더 화사하고 채도가 높게 촬영되는 결과물을 보여준다는 차이를 확인할 수... ",함영민의 디카갤러리,https://blog.naver.com/dicagallery,20210412
[<b>아이폰12</b>] 블랙...개봉기..언박싱!,https://blog.naver.com/splendidly?Redirect=Log&logNo=222344999490,프로는 램용량이 6G...그냥 12는 4G.... 아이폰은 워낙에 메인 프로세스 성능이 빠르니깐.... 그냥 <b>아이폰 12</b>로 충분할 거 같아서!!! 일단 박스는 아주 단촐합니다. 확실히 내용물이 줄어들어서 박스의 두께가 많이... ,인생을 재미있게...맛있게...의미있게...,https://blog.naver.com/splendidly,20210510
<b>아이폰12</b>미니 가격 10만원대에 구매한 후기,https://blog.naver.com/wgshmth?Redirect=Log&logNo=222341929485,어떻게 이렇게 착한 가격에 iphone 12 미니를 구매할 수 있었고 더불어 <b>아이폰 12</b>미니의 스펙도 살포시 알려드리도록 할게요. iphone 12 미니 작지만 성능은 끝내줘요 최근에 출시된 iphone 시리즈들에 비해... ,아무것도 미루지 말라.,https://blog.naver.com/wgshmth,20210507
<b>아이폰12</b> 퍼플 매력은 20만원대 가격이지,https://blog.naver.com/09tellecom?Redirect=Log&logNo=222346550360,기종은 #<b>아이폰12</b>퍼플 이다. &quot; 단조롭지 않은 컬러의 매력 최근 출시된 지 반 년 가량 지난 폰이 다시 등장하면서 스마트폰 시장에는 다시금 새로운 바람이 불고 있다. 12 시리즈는 이미 등장할 때부터 뜨거운... ,"옆커폰-휴대폰성지,호갱탈출,시세표,꿀팁,뽐뿌,옆동네",https://blog.naver.com/09tellecom,20210511
빅쏘 <b>아이폰12</b>프로 강화유리 필름 구입 쿠팡 로켓배송 구매,https://blog.naver.com/tlwmzp123?Redirect=Log&logNo=222352611045,지난번 잠시 학교에 있을때 사용중이던 <b>아이폰12</b>프로에 붙여둔 알리발 강화유리 필름이 낙하로 인해... 새로 부착할 빅쏘 #<b>아이폰12</b>프로 #강화유리 필름입니다. <b>아이폰12</b>프로와 <b>아이폰12</b>는 디스플레이 규격... ,Phomolog,https://blog.naver.com/tlwmzp123,20210516
"케이스티파이 케이스 <b>아이폰 12</b> 프로맥스 후기, 할인코드... ",https://blog.naver.com/kitty1993o?Redirect=Log&logNo=222352556252,"어마어마한 크기 때문에 뭔가 귀여운 느낌이 없었는데, <b>아이폰 12</b> 프로맥스 케이스로 아기자기하게 다시 태어난 느낌이에요. 케이스티파이 아이폰 케이스는 실리콘과 플라스틱을 사용한 제품이지만 재활용... ",Choi Muse.,https://blog.naver.com/kitty1993o,20210516
<b>아이폰 12</b> pro 자급제 가격 할인 좋네요,https://blog.naver.com/berebere78?Redirect=Log&logNo=222302070301,<b>아이폰 12</b> pro 가격은 100만원대이며 12 시리즈의 네가지 라인업 중 두번째로 높은 모델인데요. 그래서 기본 성능이 다른 기종보다 높은편입니다. 다른점은 기본 사이즈와 디스플레이 크기와 해상도 등... ,배레배레의 블로그,https://blog.naver.com/berebere78,20210407
<b>아이폰 12</b> pro max 케이스 무직타이거 범이 들어왔소!,https://blog.naver.com/tears1124?Redirect=Log&logNo=222296354319,아이폰 케이스로 선택한 무직타이거 제품은 하드슬림케이스 중에서 그립감도 좋고 버튼 조작성을 해치지 않으면서도 호랑이라는 레어한 이미지 디자인을 적용하여 개성이 넘치고 감각적인 <b>아이폰 12</b> pro max... ,대니얼과 제이미의 리뷰노트,https://blog.naver.com/tears1124,20210402
<b>아이폰12</b>pro가격 늦게 구매해서 할인 30만원 받고 구매 이득,https://blog.naver.com/xelloc21?Redirect=Log&logNo=222342575499,<b>아이폰12</b>pro와 <b>아이폰12</b>프로 max 랍니다 이번 12시리즈에서 눈에 띄는 점이 mini가 출시가 되었다는 건데요 초기 아이폰의 컴팩트한 사이즈를 그리워하는 아이폰 유저들에게 많은 호응이 있었죠 저도 12미니와... ,원자블로그,https://blog.naver.com/xelloc21,20210508
<b>아이폰12</b>퍼플기기값 LG유플러스가 갑이네요.,https://blog.naver.com/elribbon?Redirect=Log&logNo=222347791290,성능도 뛰어난데요 아이폰 사상 최고의 디스플레이에 새로운 Ceramic Shield 소재로 되어 있어서... 갖고 싶은 iPhone12퍼플! <b>아이폰12</b>퍼플기기값 혜택 많은 LG유플러스에서 가입하시고 혜택 챙기세요.... ,앨리의 러블리 데이즈,https://blog.naver.com/elribbon,20210512
[내돈내산] 쿠팡 <b>아이폰12</b>프로 골드 자급제 후기,https://blog.naver.com/dalki1129?Redirect=Log&logNo=222351877865,내/돈/내/산 아이폰13이 나온다 하고 <b>아이폰12</b> 퍼플 컬러가 새로 나왔는데 임시 저장에 묵혀있다가 이.제.야. 쓰는 <b>아이폰12</b>프로 골드 자급제 (쿠팡) 구매후기 ㅎㅎ 휴대폰 가게에서 구입할 땐 지원금 많이 주는... ,난해한 생명체 ♬엘케로,https://blog.naver.com/dalki1129,20210515
주파집 <b>아이폰12</b> 강화유리필름 2가지 제품 사용후기.,https://blog.naver.com/wjdtnstjd?Redirect=Log&logNo=222350204314,작년 10월 <b>아이폰12</b>프로를 새로 구입하고 난뒤 <b>아이폰12</b>에 맞는 여러가지 악세사리 제품들을 여러개 구입을 해서 사용을 하고 있었는데요. 그당시 구입했던 제품중 액정보호필름의 경우에는 주파집의 액정보호... ,순댕이의 블로그,https://blog.naver.com/wjdtnstjd,20210516
<b>아이폰12</b> 미니 자급제폰 싸게 사는 법(feat.이마트 에이스토어),https://blog.naver.com/topann?Redirect=Log&logNo=222350326136,새로운 아이폰을 사기로 했어요. 우리남편 알고보면 앱등이.. 라이트유저인 남편에게는 <b>아이폰12</b> 미니가 기능도 사이드도 딱이라 고민없이 <b>아이폰12</b> 미니로 모델 정했구요. 통신사 변경없이 기기변경만... ,'리얼버라이어티 라이프',https://blog.naver.com/topann,20210514
경기 고양휴대폰성지에서 <b>아이폰12</b>미니 가격 10만원대 구매후기,https://blog.naver.com/uokmanse?Redirect=Log&logNo=222349991259,"아이폰미니는 작지만 스펙은 12와 거의 비슷하답니다. 귀여운 디자인, <b>아이폰12</b> 미니 <b>아이폰12</b> 미니는 귀여운 사이즈와 디자인 때문인지 여자분들에게 인기가 많다고 하더라고요. 안그래도 요즘은 화면이 큰... ","영원한건 없지만 말야,",https://blog.naver.com/uokmanse,20210513
제주휴대폰성지에서 <b>아이폰12</b> 가격 30만원대에 구매한 후기,https://blog.naver.com/cnwedding1?Redirect=Log&logNo=222348039078,제주휴대폰성지에서는 아이폰도 싸게 구입할 수 있더라고요. 가격차이가 워낙 많이나서 이제 일반 대리점은 못갈거같아요. [<b>아이폰12</b>의 스펙] 사실 저는 이 폰 디자인만 봤을 때도 구매욕구가 상승했었는데요.... ,결혼이야기,https://blog.naver.com/cnwedding1,20210512
<b>아이폰12</b> 미니 자급제 통신사와 비교해봄,https://blog.naver.com/hochil?Redirect=Log&logNo=222343116149,iPhone12 MINI가 새롭게 출시되었는데요. 아담한 크기의 미니멀리즘을 실현하는 아이폰 유저들을... 그래서 최근에는 <b>아이폰12</b> 미니 자급제에 대한 관심이 더욱 높아지는 추세입니다. 오히려 통신사를... ,길따라 바람따라,https://blog.naver.com/hochil,20210510
작고 앙증맞은 <b>아이폰12</b>미니 (공시지원금 vs 선택약정),https://blog.naver.com/withzzinpang?Redirect=Log&logNo=222354360877,가격도 착하고 디자인도 이쁜 <b>아이폰12</b>미니. 폰 바꿀 때 되신 분들 한번 참고해보세요~ 아이폰이든 갤럭시든 휴대폰을 살 때 요즘에는 두 가지 방법이 있더라고요. 공시지원금을 받고 사는 경우 : 당장 내는 돈이... ,달콤한 밤비네,https://blog.naver.com/withzzinpang,20210517
<b>아이폰12</b>pro max 256 자급제로 3년만에 교체:),https://blog.naver.com/inun0611?Redirect=Log&logNo=222347567654,<b>아이폰12</b>pro max 256 3년이 넘어서 정말 오랜만에 핸드폰을 바꾸었다. ㅋ 원래는 더 쓸려고했는데 시간이... 지금 아이폰8을 쓰고 있었고 이미 할부가 끝나고 요금제가 2만원도 안나왔던게 너무 좋았고 5G는 쓰고... ,♪,https://blog.naver.com/inun0611,20210512
<b>아이폰 12</b> Pro Max 사용기,https://blog.naver.com/romance?Redirect=Log&logNo=222354715937,얼마전 울 애들이 생일선물로 <b>아이폰 12</b> Pro Max를 선물해주는 바람에 뜻하지 않게 아이폰X Pro에서 폰을 갈아타게 되었다. 뭐 내용 사용후기가 정확한 것은 아니고 대충 주마간산이니 너무 심각하게 이 리뷰를... ,까르페 디엠 (Carpe diem),https://blog.naver.com/romance,20210517
<b>아이폰12</b> 미니 퍼플 색상 도착! 예약 구매 후기,https://blog.naver.com/aiwositai?Redirect=Log&logNo=222327489162,"<b>아이폰12</b> 미니는 현지시각으로 2020년 10월 13일 공개된 애플의 스마트폰입니다, 출시된 지 꽤 오래지난... 이번 12 미니 퍼플이 첫 아이폰이라면, 어댑터를 별도로 구매하셔야 하는 점 참고하시기 바랍니다.... ",코예커플 IT,https://blog.naver.com/aiwositai,20210430
<b>아이폰 12</b> 프로 맥스 카메라 리뷰를 공유드릴게요,https://blog.naver.com/transartists?Redirect=Log&logNo=222350893951,아이폰 망원 카메라의 공식 스펙은 다음과 같습니다. [<b>아이폰 12</b> 프로 맥스 카메라] 망원 카메라 스펙 망원 카메라는 주변의 공간이 충분하고 멀리서 자세한 사진을 찍을 때 유용합니다. 음식 사진을 멀리서... ,세상의 모든 공부 - 세모공,https://blog.naver.com/transartists,20210517
<b>아이폰12</b> 화이트 128GByte 살짝 보기,https://blog.naver.com/sayblog?Redirect=Log&logNo=222352038904,무선충전은 일반 QI충전기로 잘 됩니다. 충전할때는 또 5G로 변경되었네요. :) 애플의 UX에 익숙해지는 일만 남았습니다. 10년 가까이 안드로이드기기만 썼더니 아직 적응이 안되네요. :) #<b>아이폰12</b> #SKT아이폰 #5G,山만한블로그를 꿈꾸는...,https://blog.naver.com/sayblog,20210515
맥세이프 충전기 두대 동시에 가능한 <b>아이폰12</b>충전기,https://blog.naver.com/thkimnguy?Redirect=Log&logNo=222354722337,^^ 맥세이프충전기 구매하러가기 #맥세이프충전기 #무선충전기 #2in1무선충전기 #<b>아이폰12</b>충전기 #충전기 #초텍 #아이폰무선충전기 #핸드폰거치대 #스마트폰거치대,테리의 일상,https://blog.naver.com/thkimnguy,20210517
<b>아이폰 12</b> 미니 퍼플 개봉기 및  KT 가입 혜택,https://blog.naver.com/gpicture?Redirect=Log&logNo=222344863233,"아이폰11에서 큰 인기를 모았던 퍼플이 컬러가 4월 30일 <b>아이폰 12</b>와 <b>아이폰 12</b> 미니에서도 출시가... <b>아이폰 12</b> 미니와 <b>아이폰 12</b>의 가장 큰 차이점이라면 전체적인 사이즈이고, 듀얼 12MP 카메라를 탑재하여... ",이쁜이기린의 리뷰 세상,https://blog.naver.com/gpicture,20210510
<b>아이폰12</b>미니 가격 10만원? 스펙 살펴보기,https://blog.naver.com/ha_tak?Redirect=Log&logNo=222323866904,"이번에 새롭게 출시한 맥세이프도 지원을 하는데, 편리하게 부착해서 무선 충전도 가능하고, 카드지갑 케이스를 아이폰에 부착하여 이용할 수도 있다. <b>아이폰12</b>미니에서 여러 철학과 설계가 들어갔으며... ",리뷰빌런 하텍,https://blog.naver.com/ha_tak,20210426
"LG 유플러스 <b>아이폰12</b>퍼플구매꿀팁, 유보라 해~",https://blog.naver.com/hanr7?Redirect=Log&logNo=222346113392,공개한 <b>아이폰12</b>를 보고 정말 깜짝 놀랐어요 아이폰은 신제품이 출시될 때마다 독보적인 디자인과 컬러를 선보이는데요 이번에 출시된 iPhone 12 Pro / iPhone 12 Pro Max / iPhone 12 / iPhone 12 mini 4가지 모델 중에... ,보니비의 내 영혼이 따뜻했던 날들,https://blog.naver.com/hanr7,20210511
"<b>아이폰 12</b>를 위한 보호력 좋은 케이스, 킹콩 이너백 투명케이스... ",https://blog.naver.com/jsk5341?Redirect=Log&logNo=222354757678,"투명한 PC 소재가 사용된 덕분에 파랗디 파란 아이폰의 색감이 그대로 바깥까지 깔끔하게 비칩니다.... <b>아이폰 12</b> 프로맥스는 카툭튀가 심한 편에 속하기 때문에, 대부분의 케이스들은 카메라 주변에 범퍼가... ",바람의 What is 'IT'?,https://blog.naver.com/jsk5341,20210517
처비캣 강화유리필름으로 <b>아이폰12</b>프로맥스 안심보호하기~,https://blog.naver.com/yuly486?Redirect=Log&logNo=222351903439,강화유리필름 붙이고 세상 마음에 안전을 찾은 저입니다!! 나의 핸드폰은 소중하잖아요~ #처비캣 #강화유리필름 #강화유리필름추천 #아이폰강화유리 #<b>아이폰12</b>프로 #처비캣3D강화유리필름,"속닥속닥,소박한튼튼네",https://blog.naver.com/yuly486,20210515
<b>아이폰 12</b> 쌈무그린 한 달 사용 후기,https://blog.naver.com/kbsomang?Redirect=Log&logNo=222346357331,화이트는 너무 무난한 거 같고 12라는걸 팍팍! 뽐내기 위해서 트렌디한 쌈무그린을 구매했는데요... 이번 <b>아이폰 12</b>는 기존의 아이폰들이 상위 모델에만 적용했던 OLED 를 일반 모델에도 적용했다는 매우 큰... ,SURE SURE # 쉬워쉬워,https://blog.naver.com/kbsomang,20210511
<b>아이폰12</b> 할인혜택 받고 구매한 사용후기,https://blog.naver.com/dy06260626?Redirect=Log&logNo=222346700487,동생선물로 사주고 사진은 제가 더 많이 찍어달라고 하는 거같아요ㅎㅎ이참에 저도 <b>아이폰12</b> 할인혜탣 받고 구매할까 진지하게 고민하고 있답니다~아이폰 이제 비싸게 구매하지 마세요. 퍼플망고 쇼핑몰에서... ,팅의 일상,https://blog.naver.com/dy06260626,20210511
<b>아이폰12</b> 프로맥스 케이스 진짜 카본 프리미엄 투알텍 케이스,https://blog.naver.com/bizzy78?Redirect=Log&logNo=222322871796,리얼 카본 넣은 <b>아이폰12</b> 프로맥스 케이스 스포츠카 내장재로 활용되는 카본인 만큼 가볍고 튼튼하다는... 어설프게 카본 케이스라고 구매했는데 아이폰 수신 안테나가 떨어지면 곤란하겠죠. 비싼 값을 하는만큼... ,이지이 IT창고,https://blog.naver.com/bizzy78,20210425
<b>아이폰 12</b> pro 골드 언박싱♥,https://blog.naver.com/p900404?Redirect=Log&logNo=222346138836,[ <b>아이폰 12</b> pro 골드 ] #아이폰프로 #<b>아이폰12</b>프로 #<b>아이폰12</b>pro © 글/사진 컁 blog 아 드디어 나의 오랜 숙원사업 드디어 핸드폰 바꾸기 미션 클리어 한참 아이폰만 쭈욱 쓰다가 이제는 갤럭시로 한번 갈아타볼까... ,컁 blog,https://blog.naver.com/p900404,20210511
<b>아이폰12</b> 퍼플 KT 혜택 최고 정품 액세서리 할인,https://blog.naver.com/cshee32?Redirect=Log&logNo=222343553584,참고로 이번 퍼플 컬러는 <b>아이폰12</b> 및 mini 제품에 한 해 추가로 출시되었습니다. 스펙의 경우 12시리즈와 크게 다를 것이 없습니다. 6.1인치 화면 크기와 162g의 무게로 전작보다 가볍고 컴팩트한 크기를... ,네버엔딩금별스토리 '직장맘 후딱 밥해 먹기',https://blog.naver.com/cshee32,20210510
<b>아이폰12</b>미니 정품 맥세이프 가죽케이스 후기,https://blog.naver.com/nueyet?Redirect=Log&logNo=222332202711,"예전부터 아이폰 정품 가죽케이스를 사고 싶다는 생각은 했지만, 가격때문에 항상 못샀다. 그러다가 어느 날 투명 케이스 6번 교체하면 <b>아이폰12</b>미니 정품 가죽케이스를 살 수 있다는 말도 안되는 생각으로 구매.... ",너굴의 Eye T,https://blog.naver.com/nueyet,20210508
